{
  "$schema": "https://json-schema.org/draft/2020-12/schema",
  "$id": "https://example.invalid/code-guide.schema.json",
  "title": "code-guide document",
  "type": "object",
  "required": [
    "version",
    "title",
    "nodes"
  ],
  "additionalProperties": false,
  "properties": {
    "version": {
      "const": 1
    },
    "title": {
      "type": "string",
      "minLength": 1
    },
    "description": {
      "type": "string"
    },
    "root": {
      "type": "string",
      "default": "."
    },
    "nodes": {
      "type": "array",
      "items": {
        "$ref": "#/$defs/node"
      }
    }
  },
  "$defs": {
    "location": {
      "type": "object",
      "required": [
        "file",
        "line"
      ],
      "additionalProperties": false,
      "properties": {
        "file": {
          "type": "string",
          "minLength": 1
        },
        "line": {
          "type": "integer",
          "minimum": 1
        },
        "column": {
          "type": "integer",
          "minimum": 1
        },
        "symbol": {
          "type": "string",
          "minLength": 1
        },
        "anchor": {
          "type": "string",
          "minLength": 1
        }
      }
    },
    "node": {
      "type": "object",
      "required": [
        "id",
        "title"
      ],
      "additionalProperties": false,
      "properties": {
        "id": {
          "type": "string",
          "minLength": 1,
          "pattern": "^[a-z0-9][a-z0-9-]*$"
        },
        "title": {
          "type": "string",
          "minLength": 1
        },
        "comment": {
          "type": "string"
        },
        "location": {
          "$ref": "#/$defs/location"
        },
        "children": {
          "type": "array",
          "items": {
            "$ref": "#/$defs/node"
          },
          "default": []
        }
      }
    }
  }
}
