{
  "version": 1,
  "title": "Authentication request path",
  "description": "A small example showing how a request moves from routing through authentication and into the handler.",
  "root": ".",
  "nodes": [
    {
      "id": "request-processing",
      "title": "Request processing",
      "comment": "Start with the main request lifecycle before drilling into the authentication branch.",
      "children": [
        {
          "id": "request-entry",
          "title": "Request entry point",
          "comment": "Incoming requests are normalized here before routing. Identify the request object passed to the next phase.",
          "location": {
            "file": "src/server.c",
            "line": 120,
            "column": 1,
            "symbol": "handle_request",
            "anchor": "handle_request("
          },
          "children": []
        },
        {
          "id": "routing",
          "title": "Route selection",
          "comment": "The route is resolved here. Authentication behavior is selected from route metadata rather than inside each handler.",
          "location": {
            "file": "src/router.c",
            "line": 88,
            "column": 1,
            "symbol": "resolve_route",
            "anchor": "resolve_route("
          },
          "children": [
            {
              "id": "authentication",
              "title": "Authentication gate",
              "comment": "Credentials are checked before dispatch. Pay attention to the state returned on authentication failure.",
              "location": {
                "file": "src/auth.c",
                "line": 210,
                "column": 1,
                "symbol": "authenticate_request",
                "anchor": "authenticate_request("
              },
              "children": []
            },
            {
              "id": "handler-dispatch",
              "title": "Handler dispatch",
              "comment": "After authentication succeeds, the selected handler receives the normalized request and identity.",
              "location": {
                "file": "src/handler.c",
                "line": 55,
                "column": 1,
                "symbol": "dispatch_handler",
                "anchor": "dispatch_handler("
              },
              "children": []
            }
          ]
        }
      ]
    }
  ]
}
